{
  "format": "tilefoundry.warpgroup_program.v1",
  "warp_groups": 3,
  "types": {
    "q_tiles": {
      "shape": [
        9,
        64,
        64
      ],
      "dtype": "bf16",
      "space": "shared"
    },
    "kv_blocks": {
      "shape": [
        2,
        2,
        9,
        64,
        64
      ],
      "dtype": "bf16",
      "space": "global"
    },
    "kv_tile": {
      "shape": [
        64,
        64
      ],
      "dtype": "bf16",
      "space": "shared"
    },
    "score": {
      "shape": [
        64,
        64
      ],
      "dtype": "fp32",
      "space": "register"
    },
    "probability_accum": {
      "shape": [
        64,
        64
      ],
      "dtype": "fp32",
      "space": "register"
    },
    "probability": {
      "shape": [
        64,
        64
      ],
      "dtype": "bf16",
      "space": "register"
    },
    "shared_probability": {
      "shape": [
        64,
        64
      ],
      "dtype": "bf16",
      "space": "shared"
    },
    "row": {
      "shape": [
        64,
        1
      ],
      "dtype": "fp32",
      "space": "register"
    },
    "shared_row": {
      "shape": [
        64,
        1
      ],
      "dtype": "fp32",
      "space": "shared"
    },
    "output_half": {
      "shape": [
        64,
        256
      ],
      "dtype": "fp32",
      "space": "register"
    },
    "validity_blocks": {
      "shape": [
        2,
        2,
        64
      ],
      "dtype": "i1",
      "space": "global"
    },
    "validity_pair": {
      "shape": [
        2,
        64
      ],
      "dtype": "i1",
      "space": "shared"
    }
  },
  "inputs": [
    {
      "id": "%q",
      "type": "q_tiles"
    },
    {
      "id": "%kv",
      "type": "kv_blocks"
    },
    {
      "id": "%validity",
      "type": "validity_blocks"
    }
  ],
  "loop": {
    "index": "%i",
    "iterations": 2,
    "iter_args": [
      {
        "id": "%m0_prev",
        "init": -1E+30,
        "yield": "%m0_next"
      },
      {
        "id": "%m1_prev",
        "init": -1E+30,
        "yield": "%m1"
      },
      {
        "id": "%l0",
        "init": 0.0,
        "yield": "%l0_next"
      },
      {
        "id": "%l1",
        "init": 0.0,
        "yield": "%l1_next"
      },
      {
        "id": "%o_left",
        "init": 0.0,
        "yield": "%o_left_next"
      },
      {
        "id": "%o_right",
        "init": 0.0,
        "yield": "%o_right_next"
      }
    ],
    "ops": [
      {
        "id": "copy_kv0_0",
        "outputs": [
          {
            "id": "%kv0_0s",
            "type": "kv_tile",
            "expr": [
              "copy",
              [
                "index",
                "%kv",
                "%i",
                0,
                0
              ]
            ]
          }
        ]
      },
      {
        "id": "copy_kv0_1",
        "outputs": [
          {
            "id": "%kv0_1s",
            "type": "kv_tile",
            "expr": [
              "copy",
              [
                "index",
                "%kv",
                "%i",
                0,
                1
              ]
            ]
          }
        ]
      },
      {
        "id": "copy_kv0_2",
        "outputs": [
          {
            "id": "%kv0_2s",
            "type": "kv_tile",
            "expr": [
              "copy",
              [
                "index",
                "%kv",
                "%i",
                0,
                2
              ]
            ]
          }
        ]
      },
      {
        "id": "copy_kv0_3",
        "outputs": [
          {
            "id": "%kv0_3s",
            "type": "kv_tile",
            "expr": [
              "copy",
              [
                "index",
                "%kv",
                "%i",
                0,
                3
              ]
            ]
          }
        ]
      },
      {
        "id": "copy_kv0_4",
        "outputs": [
          {
            "id": "%kv0_4s",
            "type": "kv_tile",
            "expr": [
              "copy",
              [
                "index",
                "%kv",
                "%i",
                0,
                4
              ]
            ]
          }
        ]
      },
      {
        "id": "copy_kv0_5",
        "outputs": [
          {
            "id": "%kv0_5s",
            "type": "kv_tile",
            "expr": [
              "copy",
              [
                "index",
                "%kv",
                "%i",
                0,
                5
              ]
            ]
          }
        ]
      },
      {
        "id": "copy_kv0_6",
        "outputs": [
          {
            "id": "%kv0_6s",
            "type": "kv_tile",
            "expr": [
              "copy",
              [
                "index",
                "%kv",
                "%i",
                0,
                6
              ]
            ]
          }
        ]
      },
      {
        "id": "copy_kv0_7",
        "outputs": [
          {
            "id": "%kv0_7s",
            "type": "kv_tile",
            "expr": [
              "copy",
              [
                "index",
                "%kv",
                "%i",
                0,
                7
              ]
            ]
          }
        ]
      },
      {
        "id": "copy_kv0_8",
        "outputs": [
          {
            "id": "%kv0_8s",
            "type": "kv_tile",
            "expr": [
              "copy",
              [
                "index",
                "%kv",
                "%i",
                0,
                8
              ]
            ]
          }
        ]
      },
      {
        "id": "copy_kv1_0",
        "outputs": [
          {
            "id": "%kv1_0s",
            "type": "kv_tile",
            "expr": [
              "copy",
              [
                "index",
                "%kv",
                "%i",
                1,
                0
              ]
            ]
          }
        ]
      },
      {
        "id": "copy_kv1_1",
        "outputs": [
          {
            "id": "%kv1_1s",
            "type": "kv_tile",
            "expr": [
              "copy",
              [
                "index",
                "%kv",
                "%i",
                1,
                1
              ]
            ]
          }
        ]
      },
      {
        "id": "copy_kv1_2",
        "outputs": [
          {
            "id": "%kv1_2s",
            "type": "kv_tile",
            "expr": [
              "copy",
              [
                "index",
                "%kv",
                "%i",
                1,
                2
              ]
            ]
          }
        ]
      },
      {
        "id": "copy_kv1_3",
        "outputs": [
          {
            "id": "%kv1_3s",
            "type": "kv_tile",
            "expr": [
              "copy",
              [
                "index",
                "%kv",
                "%i",
                1,
                3
              ]
            ]
          }
        ]
      },
      {
        "id": "copy_kv1_4",
        "outputs": [
          {
            "id": "%kv1_4s",
            "type": "kv_tile",
            "expr": [
              "copy",
              [
                "index",
                "%kv",
                "%i",
                1,
                4
              ]
            ]
          }
        ]
      },
      {
        "id": "copy_kv1_5",
        "outputs": [
          {
            "id": "%kv1_5s",
            "type": "kv_tile",
            "expr": [
              "copy",
              [
                "index",
                "%kv",
                "%i",
                1,
                5
              ]
            ]
          }
        ]
      },
      {
        "id": "copy_kv1_6",
        "outputs": [
          {
            "id": "%kv1_6s",
            "type": "kv_tile",
            "expr": [
              "copy",
              [
                "index",
                "%kv",
                "%i",
                1,
                6
              ]
            ]
          }
        ]
      },
      {
        "id": "copy_kv1_7",
        "outputs": [
          {
            "id": "%kv1_7s",
            "type": "kv_tile",
            "expr": [
              "copy",
              [
                "index",
                "%kv",
                "%i",
                1,
                7
              ]
            ]
          }
        ]
      },
      {
        "id": "copy_kv1_8",
        "outputs": [
          {
            "id": "%kv1_8s",
            "type": "kv_tile",
            "expr": [
              "copy",
              [
                "index",
                "%kv",
                "%i",
                1,
                8
              ]
            ]
          }
        ]
      },
      {
        "id": "copy_validity",
        "outputs": [
          {
            "id": "%validity_s",
            "type": "validity_pair",
            "expr": [
              "copy",
              [
                "index",
                "%validity",
                "%i"
              ]
            ]
          }
        ]
      },
      {
        "id": "qk0_0",
        "outputs": [
          {
            "id": "%s0_0",
            "type": "score",
            "expr": [
              "matmul",
              [
                "index",
                "%q",
                0
              ],
              [
                "transpose",
                "%kv0_0s"
              ]
            ]
          }
        ]
      },
      {
        "id": "qk0_1",
        "outputs": [
          {
            "id": "%s0_1",
            "type": "score",
            "expr": [
              "matmul",
              [
                "index",
                "%q",
                1
              ],
              [
                "transpose",
                "%kv0_1s"
              ]
            ]